asin,name
63N02JK10S,Green New Bad Eraser
BDC04ENWFY,Aqua New Huge Marker
YIHJS8ZU50,Orange Steel Fun Chair
BZNI14HU6S,Yellow Wooden New Computer
L0ZGHLVEHO,Blue New Big Pen
EWGYT2I7CE,Purple Wooden Big Pen
45VEXYQ2AV,Ruby Fun Really Big Trash Can
ZFO4KYERGP,7 Onyx Fun Tiny Cars
40TXLUF9TD,Blue Really Tiny Really Big Table
P9DXV7H057,Blue Wooden Huge Boat
ISI2ZZAT6M,Yellow New Steel Table
7WRSJ7BVLF,Yellow Tiny Small Book
3FB5DO9MJH,Yellow Bad Steel Table
WV2PSLSSSF,2 Yellow Fun Bad Boats
HY12AJGUV1,Purple Steel Huge Trash Can
9TWMY1VBGH,Aqua Wooden New Eraser
N0O4AVP2NN,Blue Small Ugly Book
XBPGR9TYZV,Green Fun Ugly Coffee Cup
1VW34NQXGC,White Small Big Coffee Cup
IX9Q6W2FIF,Obsidian Really Big Small Truck
P65LSXHBNJ,Yellow Wooden Amazing Trash Can
URWPUD3452,Orange Really Tiny Bad Eraser
7ITQ4HX42C,Ruby Really Tiny New Tv
TRDD6GQCR0,Red Huge Amazing Coffee Cup
56GKC732MJ,Yellow Fun Amazing Car
5WPW81YFHC,7 Green Tiny Bad Pillows
34QQ57CKRE,Golden New Tiny Marker
GWVHRIG76N,Ruby Steel Fun Video
Y5YIBAMWZA,Golden Big Wooden Marker
D8RO7WO2GV,Orange New Really Tiny Pencil
5KKNF97XCO,Red Huge Wooden Boat
VITNOJKJTQ,Ruby New Big Pillow
F99QCS5ZU7,Obsidian Small Really Big Pillow
FHBZC7ATQ6,Orange Small Ugly Boat
T4DAWVM7MF,9 Orange Small Steel Pens
BIQDEJDIRU,Black Fun Small Chair
GCKLEW7JKE,9 Onyx Amazing Wooden Books
ECF1SFCAPP,7 Green Steel Small Erasers
015T2P4WNQ,Orange Steel Small Boot
B0GSX82A45,9 Purple Ugly Really Big Markers
0AQIQAJTL8,Aqua Amazing Really Big Marker
ZOD2MYUAZ9,Green New Huge Truck
FNTYFBL5HB,Green New Amazing Boat
W9PBM4J2ZT,7 Yellow Really Big Fun Shoes
BWX2FL0JNA,Obsidian New Bad Coffee Cup
U8D6UZOC87,5 Red Ugly Steel Trucks
5QOJ9NU49L,Orange Fun Tiny Boot
Z53FEPRMAJ,Green Amazing Ugly Shoe
HQGZ50L7IN,8 Obsidian Really Big Fun Videos
G78DFENS08,Orange New Ugly Chair
Q6L1VCFRHF,Yellow New Bad Pillow
PIIYDHN63N,Green Wooden Tiny Chair
S5M8GQYKKL,5 Purple Tiny Wooden Videos
Y7687KHPHE,Red Really Tiny Ugly Pillow
LXR4WOAFZK,Blue New Amazing Eraser
T1EX034RHF,8 Red Steel Fun Chairs
78274NYSGZ,9 Purple New Amazing Pillows
NKVR0FBWJ2,Obsidian Wooden Tiny Pen
ZXXDTV406I,Obsidian Steel Really Big Eraser
N86NC80V8Y,Black Tiny Amazing Pen
60VQV6DFJ4,Blue New Fun Pencil
D8C92ZGPQQ,Orange Small Steel Shoe
CXUTGH3822,Blue Wooden Steel Boat
XV2BD1AT3Q,Black Fun Tiny Dvd
SNK205H653,8 Black Bad Wooden Pens
E8SNENZ8YP,Aqua Really Big New Pencil
XW7JY6HKY6,Purple Amazing Big Trash Can
NCPD2TIX3Q,Obsidian Fun New Car
5DX9WQMCN9,Obsidian Tiny New Book
XZD38X98F4,Aqua Really Tiny Tiny Dvd
LH7AE07FWL,Golden Huge Really Tiny Dvd
AWUHNS95CG,Aqua Huge Really Big Boot
ZIWZIU4AZB,Blue Tiny Big Video
G7JH6CWFGE,Obsidian Amazing Ugly Marker
NCN27CL4XX,Green Wooden Huge Eraser
2V4KM2E4IK,Blue New Fun Eraser
20BT4BXHBU,Black Fun Really Tiny Dvd
F9X8KZFACW,Aqua Small Ugly Eraser
XLHTDAH58A,Blue Huge Steel Chair
RULWHHYLP0,Ruby Bad Really Tiny Table
H6EC4PDGAC,Ruby Ugly New Shoe
3BWFDMSBEV,Purple Small New Dvd
UX6SU5QZUP,Aqua Wooden Really Tiny Video
EKEU2HVHC3,Yellow Big Really Big Boot
JFHAKGLOKF,Golden Big Wooden Boat
OC7BBXIHFB,Aqua Big Steel Book
558L1D482F,3 Golden Really Tiny Big Coffee Cups
5B4H8CTOQO,Green New Ugly Video
UF5DXO34B2,Ruby Huge Really Tiny Truck
663IN7RP42,4 White Small New Books
DESUY0K06Z,Yellow New Huge Marker
PUEUN9HA9B,Yellow Fun Wooden Coffee Cup
VU5YAWP3KJ,Aqua Wooden Steel Boot
1MF5E39CBI,Aqua Huge Big Chair
B62YX0B7PK,2 Aqua Bad Huge Tables
TXT4BEQ1L7,Purple Fun Really Big Pencil
677D3PYAN2,Aqua Big New Eraser
R1ZDJOZ5KG,Yellow Steel New Pencil
DVQPXV08DU,Black Really Tiny Tiny Book
M98I2AJ2RG,Red Wooden Bad Book
A2IS65TJV5,Red Big Small Eraser
IKLH9CI5TX,9 Red Ugly Bad Pencils
5ZX3MQP8GD,Black Ugly Huge Tv
RITD04QK0S,Red New Steel Chair
WRHV93P7FQ,Ruby Steel Ugly Computer
HLJ68S8HIZ,Orange Small Ugly Pencil
9L8AEDCD25,Green Bad Big Boot
8VIQTLQOZI,Yellow Really Tiny Fun Pen
7UMA4R6WXF,2 Red Fun Bad Trash Cans
SDFWF4N4MC,Obsidian New Amazing Marker
PTAFQ6SS2E,9 Ruby New Ugly Videos
WMLZ14Q6FD,Onyx Amazing Fun Coffee Cup
8IE5LVMM9H,6 Ruby Ugly Amazing Dvds
GMI9GXABIQ,7 Aqua Small Steel Books
V0IXS0LCNP,9 Obsidian Huge Big Pens
4881U04E8O,Aqua Wooden Amazing Shoe
B7EL7XM2HC,7 Ruby Big Bad Tables
0TG6VVJL5D,Black Huge New Dvd
BG5BY9MQM4,2 Blue Fun Huge Trucks
JUME1WOXRB,6 Obsidian Steel Tiny Shoes
PJIMUAVTHG,5 Aqua Big Ugly Books
9YZAM0A9KN,9 Obsidian Steel Wooden Shoes
CQ67NVTAL8,Aqua Steel Big Car
GBWFLRU7WX,Yellow Ugly Tiny Boot
MYKKGGGBQ2,Aqua New Tiny Trash Can
9BW6DEBT08,9 Orange Huge Bad Shoes
1I6J5NYJ40,Golden Fun Steel Shoe
WFOJSMMBBP,Red Steel Really Tiny Eraser
ZEEMEOYO56,Ruby Huge Ugly Table
FCMWAM06LD,Red Small Steel Truck
PTXMZCO7CR,Orange Really Tiny Big Coffee Cup
TR9DP7XY2C,4 White Really Tiny Really Big Tvs
JB7OU4GJ80,7 Onyx Ugly Really Big Erasers
GDJP6KWT7Z,Ruby Big Amazing Computer
2IBFUKBE63,Golden Wooden Small Truck
CTPEZPU5UQ,Golden Really Big Fun Pen
2ISWB92RDA,Green Ugly Wooden Pen
N3EDICZQJB,4 Yellow Wooden Really Big Computers
UQHK90F9ZH,Onyx Wooden Huge Book
2TSB1M17HC,Blue Ugly Really Big Marker
QX8PGVR9BX,Golden Really Big Bad Table
CA5WV6KPP3,Golden Ugly Bad Tv
9KJTOT0XAC,Aqua Huge Fun Table
599KB1L0X4,Purple Big Huge Marker
ZPK2LLIV0N,Purple Amazing Steel Boat
RNXAIH52QL,9 Obsidian Huge Bad Coffee Cups
GVFGC1VG42,4 Red Huge Tiny Trucks
F0TTIB7UMS,4 Golden Really Big Huge Boats
NGKHJ49JUP,White Really Tiny Really Big Pen
5Z1TMIV8PD,7 Golden Really Big Tiny Pens
UXJKCLDFT2,Golden Small Bad Coffee Cup
XEYQFP9YQ4,Purple Bad Wooden Coffee Cup
TJ6BR4U3O1,Purple New Small Marker
V47DAFX9RX,Obsidian Small New Tv
AVF35ZBO8O,8 Golden Really Tiny Small Trash Cans
RQFTZ08XLB,Onyx Fun Wooden Truck
P5U2UHH7F1,Ruby Fun Amazing Pencil
YDE9EJIGTF,Yellow Wooden Big Pen
3160MVATS5,Ruby Ugly Really Big Video
RVAZBEQXTP,Ruby Big Really Tiny Boot
7X8EQHTJOZ,Blue Really Big Really Tiny Truck
K7U1U1VQR8,Ruby Big Ugly Dvd
L2K03NMP1D,5 Orange Bad Big Shoes
8FIEV0EHBN,2 Yellow Really Big Bad Trash Cans
KR95FZ94TX,Blue Small Amazing Marker
7URWM26KPQ,Aqua Really Tiny Steel Video
311CFAU47H,Blue Big Wooden Dvd
82XBWHOVVO,White Ugly Tiny Video
W87T3XHOWC,Obsidian Small Really Tiny Table
C71XYD1T5K,Green Really Big Small Book
IDTN2SI7ZZ,Red Fun Really Big Boat
FR0W7JQZ7U,Aqua Small Steel Eraser
7282ZP47Y5,White Tiny Steel Shoe
HO34X3MN6S,Black Amazing Ugly Dvd
ITKH5NTAKY,8 Ruby Big Small Trucks
LFMHF3TN8I,9 Obsidian Wooden Really Tiny Trash Cans
AT07L2U1K9,Orange Huge Really Tiny Pen
P7SE6Y6EMB,Blue Amazing Really Big Boot
VNLWUET63R,4 Onyx Amazing Really Big Cars
F5WSXRBCL6,Purple Wooden New Dvd
ISV4QS8WEV,White Small Tiny Table
57NTR14MP5,Blue Amazing Fun Pencil
4LV62IEYV4,Aqua Tiny Really Big Book
E15ELEMYO2,Green Really Big Really Tiny Computer
Q3V0RC5JVI,Golden Wooden Fun Pillow
ONC0BZJNSS,Golden Amazing Fun Eraser
N8BVK1LR5B,Red Wooden Fun Pen
W8ENM7PTHF,Black Fun Wooden Tv
JXHMLN35MV,Golden Ugly Big Car
MWXEDNAAQ7,7 Obsidian Amazing Ugly Boats
7OFTM6UVET,Orange Amazing Bad Pillow
706LZW5CBE,Red Really Tiny Small Boot
YYEIKK634A,7 Ruby Huge Really Tiny Shoes
E19M1KOTZR,Golden Ugly Steel Trash Can
HHSL4ZBHMH,4 Yellow Huge Small Books
MVE54UVYBW,Blue Amazing Bad Table
396DMUJB3P,Yellow Wooden Steel Marker
QG52I8CJF9,Red Ugly Tiny Truck
4L2PZUHKTE,Purple Wooden Huge Boat
UTYH3QXV6G,Green Huge Really Tiny Car
49Z2Y0EANB,9 Ruby Huge Ugly Cars
WFA9KSA6WF,Blue Amazing Really Big Dvd
CVJ7HGRKWO,Green Huge Wooden Car
W1QQFD1JFB,Aqua Tiny Really Tiny Book
0TXFZCOZJ9,Red Steel Big Boot
R9AW9F05WZ,White Small Big Truck
GL2PZYKWOZ,Yellow Wooden Huge Boat
Z2X82PNFBY,Onyx Tiny New Pillow
XN40DQK6FL,Orange Steel Really Tiny Book
RKSHU7VFTU,Green Steel Ugly Pencil
VD8CWWNXC6,Yellow Tiny Steel Car
OB00Z6T0JH,Red New Huge Table
SKGT0E4TCV,9 Green Small Really Tiny Pencils
B5630GAMBW,Red Small Fun Boat
A4FNLB1YV3,Aqua Small Bad Trash Can
SKQ320UFKK,Red Wooden Really Big Marker
LTNR2JW52T,2 Blue Tiny Really Tiny Boots
JRKDSJF0VQ,Orange Big Amazing Boat
0X6WX53VFU,4 Aqua Really Big Bad Chairs
VUATXOASQY,Green Steel Really Tiny Coffee Cup
9T135M3GAK,8 White Small Big Books
83ZZYZS24P,Green Bad Small Pen
VSBJ6L9X5S,White Huge Tiny Boot
SE7MU6FC4O,Black Really Big Big Eraser
8US2H394AI,Blue Ugly Really Tiny Boot
1E350DMEP5,Orange Bad Small Computer
NDJKZD9932,Green Wooden Ugly Marker
RI9L70FT27,Red Fun Small Pillow
I59P9VQ0OY,Onyx Fun New Eraser
N8WEZI4HIS,Aqua Really Tiny Small Trash Can
65JGAB5CJO,Green Big Small Trash Can
HOOQOQGGLR,Obsidian Big Fun Trash Can
C1FG6ARMM6,Black Small Wooden Book
G3KGWPUVX9,Onyx Really Big Small Dvd
AV8AHDBZUX,Blue Wooden Amazing Pencil
NWN9Q0SLC0,Blue Small Big Computer
HO7KAF1GWA,Orange Fun Bad Tv
DKUZ7L7DBY,3 Golden Huge Tiny Coffee Cups
GU4B832GKI,Blue Ugly Bad Tv
MJ96FS49MD,Purple New Amazing Video
ONV8D5HMKA,Golden Huge Really Tiny Video
2A857YILUD,Onyx Wooden Ugly Dvd
39NLNT5YFQ,Golden Big Really Tiny Shoe
9L1EM3NWG7,Orange Big Really Tiny Trash Can
22U00SL8UI,8 Purple Fun Ugly Videos
UFRWKT8V9A,Golden Huge Bad Pencil
EC0VEJLLYM,Green Huge Really Big Pillow
8Q1EGR0VUQ,Black Fun Amazing Coffee Cup
M5VHSKPJ0K,Orange Big Amazing Table
XM27IIU718,Purple Huge Steel Shoe
9FHZBGUUN0,7 Aqua Bad Really Tiny Boots
TCRZE9845J,Green Steel Amazing Marker
98J4QCELKN,Black Amazing Ugly Boat
5HANWUQZO3,Onyx Bad Big Eraser
R5BAA52VZ2,Blue Tiny Big Trash Can
8FECU0KTTE,Black Fun Really Big Boot
BFDBLMJS71,Red Small Amazing Pillow
NU4I5PMYOE,Purple Fun Really Big Shoe
018TX16HWS,Red Really Big New Car
KUGH50THPP,2 Red Really Big Huge Computers
D2OY6OI7OV,Aqua Ugly Steel Pen
EWZHNSF2DR,Orange Really Tiny Bad Truck
G65V6FI3DL,Ruby New Ugly Pillow
9IZ0Z2ULF4,Black Huge Steel Book
50CI5UW9JQ,Ruby Ugly Tiny Table
ZH7ANJ3Z1Q,Yellow Huge Tiny Shoe
18E2V97RCT,Red New Steel Boat
FHYJLWVKSS,4 Golden Tiny Ugly Tables
YJ729HF5QY,Obsidian Bad Small Marker
WSCWXHFD1H,Golden Fun New Book
SGCQAYQHON,White Tiny Amazing Trash Can
MJBAAAWNID,Yellow Ugly Big Trash Can
DKL2LEIGDN,Purple New Small Boat
UT0ONS7QNA,White Tiny Fun Coffee Cup
KPDH3LZ75J,White Steel Amazing Boat
VXS7CP2ZWM,Obsidian Ugly Really Tiny Dvd
SUY9TE95W3,Red Ugly Amazing Marker
WN3J19Q7U8,Blue New Bad Pencil
23KNAB43Z7,Red Tiny Steel Marker
S0I763SANE,Green Huge Really Tiny Trash Can
OBKLFMCBN3,Onyx Bad Huge Tv
7POAEFTVKE,Purple Tiny Huge Computer
X4V7PDOX7R,White Small Amazing Pencil
45NZSIR275,Blue New Amazing Trash Can
YY5YRUPDN2,Purple New Huge Boat
B1RHNMP5Y8,Black Really Tiny Bad Eraser
HIT86DGE7W,White Huge Big Trash Can
UA79YSVX6P,Aqua Small Wooden Shoe
VL8BWBWNXO,5 White Ugly Small Dvds
1K4MPZV7F0,Red New Huge Computer
QQ5PT24CPN,Onyx Ugly Steel Boot
79282AQT1V,Purple Really Tiny New Eraser
USZZ7GRB6A,3 Orange Small Really Big Tvs
1WEPL3MLEZ,Obsidian Bad Big Pillow
WIKI393KSK,Yellow Bad Ugly Truck
WY97I8GS2B,Blue Amazing Huge Boot
IR0M0VIOKA,7 Ruby Really Tiny Wooden Markers
S1E3S5Y1X5,Yellow Small Amazing Dvd
4NQZMYEPM4,Ruby Wooden Fun Dvd
5W4X5ZG3PM,Obsidian Fun New Coffee Cup
EKDR4555S3,Purple Ugly Tiny Book
SPGOQWTZF5,9 Red Steel Fun Shoes
4AMPD5R603,Onyx Tiny New Chair
UL9ZSV93TH,Aqua Ugly Bad Pencil
21WL55A4XU,8 White Steel Tiny Pens
VCF3D8YZSO,Black Bad Fun Shoe
9B6H3C32SS,Obsidian Steel Big Pen
THRGR2G18X,Green Steel Ugly Pen
K7TU6DBYIO,Onyx New Tiny Boot
OW22U1KO4Q,Obsidian Big Amazing Chair
9A3KQGYV3W,Aqua Amazing Really Big Video
IIST3JHDPB,Onyx Huge Tiny Car
SPBN55HQFM,9 Golden Wooden Really Tiny Shoes
CWQIZZTV44,Green Fun Small Pen
EXJRJQZ16B,8 White Big Tiny Markers
EN1IURSGQY,Red Tiny Wooden Boat
GQXQRTRTGK,Red Amazing Tiny Shoe
S62HEN7Z1M,6 Yellow Steel Bad Pillows
6THAZS0FIX,Purple Big Fun Coffee Cup
5O9RWCIIEK,5 Red Ugly Huge Shoes
XFE9IVLOT8,Blue Wooden Big Marker
11K4DGXX44,Orange Really Big Fun Truck
OUI1KDU6GV,Obsidian Bad Really Tiny Car
6ID2NOU3UO,Purple New Really Tiny Car
9EXIU983AL,White Ugly Big Table
ZYOJ81FVVT,Red Big Tiny Table
EEETP5RKCC,Ruby Bad Fun Tv
MLHXIA26CT,Obsidian Big Steel Boot
RM3WCQ9ML9,Red Really Big Amazing Tv
PMCV9OLMGG,Ruby Big New Coffee Cup
Y2K98MD7RF,Green Huge Bad Pencil
BJBQY9DJ1V,Green Ugly Huge Dvd
W4DGHHENBL,Red New Ugly Car
6S3AAWLOUJ,Obsidian Really Tiny Really Big Trash Can
AKFE2BOL9G,Red Fun Really Big Table
799VH8UHNG,Golden Steel Amazing Chair
OEWJ2UKBS2,Red Ugly Wooden Boot
S9B84RZKCA,Ruby Amazing Tiny Table
EVF50U00PT,Black Really Tiny Big Truck
CAAH65L1ZG,Aqua New Big Computer
WVKXRY8N79,Purple New Tiny Dvd
PIF4RP5TIE,Green Really Tiny Bad Computer
G1ZO80JMM2,Yellow Ugly Huge Dvd
C1GJPF9H55,Obsidian Wooden Really Big Chair
0M6KVIGTOP,Black Big Really Big Video
53WGKVPZDX,Yellow Wooden Fun Truck
XBS0LBVWP3,Purple Really Tiny Tiny Book
81ROY8WXID,Red Big Bad Video
I0HTWW8KF6,Orange Ugly Steel Coffee Cup
7XW1GW50FM,Blue Ugly Wooden Dvd
0TAMH7O30P,Aqua Really Big Wooden Tv
N8KM9C63S2,Golden Bad Ugly Eraser
BVB8Z2SM56,Ruby Big Amazing Marker
PKZK1RGSKU,Onyx New Huge Pen
K8P1YD2AYU,Green Big Really Tiny Table
Z33247FRB0,7 Black Really Tiny New Coffee Cups
SKHWDUFJBS,Orange Really Big Big Truck
UP18DUU84D,2 Red Small Tiny Markers
2U8EFUI1BE,Red New Ugly Tv
QYH85ICB1B,Golden Bad Huge Coffee Cup
4PZ0JXA8FY,Onyx Bad Really Tiny Boat
JEI7OLZOA9,Obsidian Ugly Fun Boat
BCZALCMLIP,7 Aqua Really Tiny Big Books
RA9RLI5TO2,Ruby Really Tiny Wooden Computer
VAS1B14LVK,Ruby Fun Tiny Shoe
90WWIHEKBB,Aqua Really Big Steel Marker
710DNV3X29,White Big Wooden Boot
8XGU1O4RAR,Ruby Ugly Bad Car
SGHMFQX9YE,Green Really Tiny Ugly Eraser
T0BBUHR634,7 Ruby Fun Wooden Books
2IQRY10WGG,Yellow Bad Big Shoe
EC2J8XH93H,3 Onyx Bad Really Big Trucks
MZNF02XDHU,Onyx New Really Big Car
P58KPYBUFZ,White Wooden Bad Dvd
PHA3PXHQFY,Onyx Fun Tiny Table
UNDOIM5TKJ,Obsidian Really Tiny Amazing Video
E47A84P4R4,Green Wooden Bad Truck
0MDZJS6NTP,9 Obsidian Steel Ugly Pencils
8SC3IR53B1,Green Really Big Ugly Dvd
UD0UWJVT0W,White Tiny Amazing Shoe
3DTLXR5L5T,White Tiny Amazing Pillow
PKVDLWI6FF,4 Aqua Steel Bad Boots
NAK7NZ1U8G,Blue Tiny Huge Tv
WQYARJPJPA,Yellow Really Tiny Tiny Pillow
VDDUVPPAEN,Aqua Fun Wooden Car
8BD8G8LV4K,Orange Really Tiny Big Boot
F7BHX1VEE6,Red Bad New Marker
JQK1RTEEKA,Green Really Big Amazing Pillow
PEDEDJLAER,Aqua Really Big New Truck
G540Z95U8J,Green Huge Really Tiny Pillow
T0O4DW53W4,Black Fun Amazing Pencil
AB77DX2DYM,Black New Really Big Truck
LOTJR93CSV,4 Black Huge Tiny Computers
TTZPLE6BBT,Onyx Fun Big Shoe
5MD21VPBMN,3 Onyx Tiny Really Big Pillows
U0NROZN6HO,Aqua Really Big Big Pillow
NM6OET8SO5,Golden New Big Pen
EPLOYYYOGM,2 Green Fun Huge Dvds
BKF4HJ6Q9N,Purple Ugly Fun Car
COQRO865AZ,White Tiny New Video
EQZ22MLG8C,Golden Tiny Huge Book
S0JLIJ8U16,Golden Bad Small Truck
MJ7L2NSLIS,Ruby Amazing Ugly Table
D8D1ZQJJJJ,Black Big Tiny Coffee Cup
BDY6M904FD,Golden Ugly New Boat
BLWRU3J5Y9,Aqua New Amazing Chair
NSRKR7GS7W,White Big Fun Marker
56SWZXEXUS,Obsidian Amazing Big Eraser
UI8XYP2CDS,Blue Wooden Steel Video
4UUU8JPPUZ,Aqua Bad Steel Marker
CVLX8NBPSO,3 Aqua Huge Fun Boats
NH6IJ267V9,Ruby Really Big Big Car
LZVKK1I6PV,Orange Bad New Boot
ZEC428PNT8,Blue Big Fun Pen
TBVKWBREJ6,Golden Really Tiny Ugly Eraser
7RU85UIPJC,3 Yellow Fun Small Pillows
4ZUYP7HRBF,Onyx Big Amazing Pen
QPRUDU4X1I,Yellow Small Big Eraser
JS35ZZEXKN,Aqua Huge Really Big Pen
QSGO7IZ9NE,Red Ugly Really Tiny Truck
8N0URWXZE4,Onyx Really Big Amazing Computer
386DOS9AVT,Orange New Amazing Pillow
UQNS7Q8DNI,Green Really Tiny New Coffee Cup
GCMS4M63DN,Blue Really Tiny Really Big Pen
Q3VI32OH3D,Ruby Really Tiny Ugly Pencil
MQ5SEF1PFX,Purple Fun Big Marker
585NGLZTJD,Yellow Ugly Wooden Dvd
9DPAFVG9DH,Ruby Small Tiny Marker
L1W5LV6GNP,7 Black Wooden Ugly Trucks
6AUCO82N23,Red Fun Ugly Video
9X3AP5WDZN,Purple Fun Really Big Boat
V5OKVEQCXZ,Obsidian Steel Amazing Coffee Cup
XB1H7LVWSR,8 Red Wooden Fun Videos
50CI4TECQN,5 Onyx Wooden Really Big Cars
VC4GLHMZO3,Yellow Really Big Wooden Chair
411E677LV8,4 White Small Wooden Boats
QN1CR6X8K6,Ruby Small Really Big Eraser
55J9387QA8,Yellow Fun New Eraser
08EGSCR5MJ,Black Big Steel Pillow
LFZABT0M9J,8 White Huge Wooden Cars
S750XO3WYF,Obsidian Really Tiny Huge Chair
X0VUHTK8J0,Aqua Big Really Tiny Truck
025HEZ3UU3,Yellow Steel Fun Boot
GXUV1A0IWY,Blue Big Bad Pillow
O5VFS249U3,Orange Big New Coffee Cup
ERIGRWR8LK,9 Red Really Big Small Cars
507NATYEHV,Purple Small Amazing Eraser
ISSZ26V0UV,Black Steel Fun Coffee Cup
51ZT0CUSWJ,9 Red Bad Fun Markers
ZJE5BMG3OA,Black Tiny Huge Shoe
HCLB8M8ISQ,White Fun Really Tiny Eraser
AUDR1N1T6R,6 Onyx Big Ugly Boats
Z1OP7HIEAS,Red Ugly New Pencil
M7UN4MIXDX,Purple Bad Wooden Trash Can
M95NRCRA8G,Ruby Wooden Amazing Trash Can
L25ITN0ZGK,Obsidian Big New Boat
CH2ZUAHLPP,Black Really Tiny Really Big Marker
ZS8FOVBLOB,2 Green Steel New Computers
9AP9KPYHIU,6 Ruby Really Big Ugly Boots
88K4YG5DGK,White Ugly Really Big Tv
I10ZCVQMV0,Aqua Wooden Tiny Car
L2I619PYIJ,Yellow Really Tiny Bad Car
VK3QWRPW7F,Ruby Really Big Fun Pencil
6WYMGY3HVG,Red Really Tiny Huge Video
XUA1JPOW87,Blue Huge Wooden Eraser
IGMDXIHMCS,Aqua Tiny Really Tiny Car
E58C6PCW8F,7 Orange Bad Small Computers
UNDGDU1GQW,White Fun Big Trash Can
0VIF3TCV8D,Aqua Small Really Big Pillow
R3H3E6OKP7,Purple Ugly Really Tiny Tv
E8B97XKL4G,Blue Big Steel Pillow
KYCHIFKWRK,3 Orange Small Steel Computers
3LW2S2HP3L,Blue Really Big Fun Eraser
DYGLNO058J,Yellow Fun Ugly Pillow
TNUEF1BPVK,Obsidian Big Bad Pillow
3WDAIWIYUC,Orange Huge Steel Boat
6296US0LFY,Yellow Really Tiny Wooden Table
XZ5Y5A7F6H,Yellow Tiny Wooden Pillow
1YWK16QKSJ,Yellow Really Big Wooden Trash Can
0DMSQ27ST0,Purple Big Wooden Truck
4HCV6O0SS1,Obsidian Steel Fun Table
Y7ZM7LRB31,Black Fun Ugly Car
E6J2LXT2RF,Obsidian Small Big Marker
AWGBJWAAMS,Golden Wooden Fun Boot
16MZXH5ZLO,Onyx Small Steel Book
9V6057M0RI,Golden New Huge Car
FB7JVWCA2T,Onyx Amazing Tiny Marker
UGGD59QJTI,Golden Fun Ugly Boat
M42O4FQ2VO,Ruby Really Tiny Bad Table
5AP8I6ZRFW,Obsidian Ugly Amazing Dvd
9S8AR5E521,Obsidian Big Wooden Shoe
3KMN40BN0U,6 Black Big Really Tiny Shoes
42SP2ODX60,White Really Tiny Small Computer
PJIV1W9VEX,Red Amazing Steel Car
Y9KFYHJ6W8,4 Green Ugly Big Cars
CXGFTIOHGB,Red New Wooden Computer
2ELZPZIOS0,Blue Bad Tiny Pencil
0P67TUYF6W,8 Blue Steel Ugly Chairs
78MR79QRS1,Orange Really Tiny Wooden Tv
C32SHBMYDL,8 Orange New Wooden Trucks
FCIBGN8Z9C,Purple Really Big Ugly Shoe
368X9DUX3M,Green Amazing Wooden Chair
6BJRQUWO6K,9 Green Really Tiny Small Tables
SW0QB9Y8WK,Blue New Steel Eraser
ZT838642ZM,Golden Bad New Truck
930CLUIWWZ,6 Golden Ugly Bad Tvs
5AECP1X906,8 Black Ugly Really Tiny Chairs
DKTJ9C6PNZ,6 Yellow Huge Ugly Pens
HTKH637Q81,Purple Fun Huge Pillow
0493RE8D5N,Green Big Really Big Coffee Cup
I7PFLUY9V5,Aqua Amazing Wooden Eraser
0LPW45V8LK,Aqua Bad Steel Truck
9A4W2VO7QI,Yellow Really Tiny Bad Shoe
ZGK06V4GHL,Yellow Big Tiny Book
Q42CTNI2JI,Golden Tiny Wooden Truck
6M187G9VBJ,Blue New Really Big Marker
8DM38A9P0J,Aqua Fun Amazing Computer
C4G6WQZDJX,6 Onyx Steel Ugly Trucks
MMZ5OIB7IB,Obsidian Fun Bad Car
N6PWNJ4KGC,Green Wooden Ugly Table
9W301LQEIX,6 Yellow Big Really Tiny Trucks
XCX3PHXXZS,Red New Small Marker
FQAZY9AC7S,2 Green Small Tiny Trucks
NHRILE04FK,Purple Amazing Really Big Truck
BNRIWZEE5S,Onyx Really Big Ugly Pillow
Q647LM46J8,Orange Fun Amazing Computer
UKJCDFN884,Obsidian Steel Ugly Tv
0L2VPEH7WQ,Black Ugly Really Big Car
17HQWH53AZ,Onyx Steel Really Big Car
DFXEP2E4TZ,Red Fun Bad Car
RAR3W31CP8,4 Yellow New Big Pillows
XBCJOK0T6Q,Orange Amazing Fun Pencil
YQJB7QHR4Q,Aqua Big Amazing Dvd
C2KGZ5XP17,Blue Big Ugly Pillow
86OQHO48PX,Red Fun Amazing Pen
G5D24YT9OU,Black Bad Amazing Video
BNGAL3YOHO,Purple Wooden Ugly Video
YFUQX5313R,Yellow Ugly Fun Eraser
61KXO9I5A8,Blue Big Fun Pencil
DH0H24M2V4,3 Obsidian Huge Big Boats
XOXYQVEWSA,Red Amazing Small Boat
0VS4QWV43A,Yellow Bad Amazing Shoe
HERFI8Q0BG,Purple New Tiny Book
JONC5YVUKI,Red Bad Really Big Book
9DQ9D4R7VU,Golden Steel Big Car
SW52IQSLN8,Onyx Big Bad Eraser
DGO50Q7LCV,Aqua Amazing Huge Computer
06B0UT8D1M,Golden Ugly Fun Pencil
SBIC5POFKE,Yellow Wooden Steel Chair
TZULFLW1C3,Orange Small Amazing Book
9N03ILTZOY,Obsidian Tiny Amazing Boat
ACPJ9M6LES,Golden Fun Really Tiny Dvd
PQLCSJZC2J,8 Yellow Really Tiny Amazing Boats
4SJTMTM35P,White Bad New Boat
GPXBY03RH7,Ruby Ugly Amazing Car
UG7NO1CJRK,White Small Amazing Truck
W0CJSBJB4J,White Steel Really Big Dvd
6F0O2O1OYL,Aqua Tiny Big Pen
HQH7KE41PF,Purple Bad Ugly Shoe
V4QC2Y0PMR,Obsidian Tiny Amazing Video
1JZB09QJFI,Red Big Wooden Truck
8Y5DYWIBLM,Onyx Really Tiny Huge Pen
BOPJ0950MJ,Yellow Really Tiny Fun Computer
YJPTYK923T,Purple Ugly Small Pillow
VJRBY3QJXK,Golden Big Amazing Coffee Cup
AQVS2MP8IX,Onyx Small Tiny Truck
ANBO3GQK3L,Ruby Small Tiny Shoe
B3YP893UHM,White Huge Ugly Pen
58TKC7VDK7,9 Ruby Steel Amazing Pillows
KRIEYVGE5F,Blue Really Big Bad Dvd
9FIHPOMGHJ,Red Really Tiny Huge Computer
CT7ZALXC0R,Purple Really Big Tiny Trash Can
HGG7A7U7Y1,Ruby Really Tiny Steel Boat
5RWPTKTAL7,Green Really Tiny Huge Marker
U1YFXYBG67,Ruby Big Tiny Marker
P0GPJ8IQLF,Purple Fun Really Tiny Marker
ANKTZ0TUWR,White Wooden Fun Tv
VC71JL52HH,Orange Tiny Steel Video
FVQ4Q5PO83,Red Steel Amazing Coffee Cup
BIMOO8R5JS,Onyx Bad Steel Pencil
UBJCV4HYWH,Obsidian Big Tiny Boot
JR6LLVDZ5Y,Onyx Steel Bad Shoe
TQOE4U9DWV,Blue Steel Huge Tv
5QDRF9VIXQ,Golden Steel Fun Boot
SWHT55LBV5,Golden Big New Pencil
ZM1YTO0ZVD,Green Amazing Huge Marker
PFB0KU5MAC,Onyx Bad Amazing Truck
BY8W9LH1I1,Blue Tiny Ugly Car
YZVJ55CEN1,White New Tiny Dvd
VBRK883DKB,2 Blue Big Small Trash Cans
SS67VAW5V0,6 Onyx New Amazing Pillows
CU50S34B3S,3 Obsidian Really Tiny Amazing Boots
VYIV85A10G,Red Really Tiny Wooden Pencil
R749R9A74G,5 Blue Really Big Amazing Tvs
AK37WR3RAT,Golden Fun Big Book
AQ09ICTJQP,Golden Steel Really Tiny Tv
TMDYB77RZF,Orange New Ugly Book
QRFJZ0CG6R,5 Black Ugly Fun Chairs
9APPIZLSYU,Golden Amazing Steel Book
OUDJJYNYEI,Blue Ugly Really Big Trash Can
PNEO31EM2J,Ruby Really Tiny Big Table
FN7XK4RSD7,8 Golden Small Fun Computers
OAJKKG7AO5,Obsidian Tiny Big Shoe
1LHSRVPSDC,Green Wooden Amazing Table
464MN29M7R,Orange Bad Huge Boat
HABONWAGR7,Aqua Big Bad Pillow
RX4O7NWNBT,Red New Amazing Table
C5GA79QNPK,Aqua Fun Really Big Video
VYTLOXBF8X,Golden Really Big Steel Truck
KVOPU514GG,Black Huge Really Big Pen
QUMO3YV6OM,Green Big Small Truck
S1M3YLDZLV,White Bad Ugly Computer
7F75M7CG1V,Obsidian Really Big Ugly Marker
4TQPVMJP0U,Red Really Tiny Bad Boat
F7QXTNQ3YA,2 Blue Bad Wooden Chairs
5AEOBVWK2C,Purple New Big Tv
FSLGMID5XY,Golden Big Bad Truck
KHFZ6CJCNN,Onyx Ugly Really Tiny Tv
NP8JJ31UG4,Golden Amazing New Pencil
I1S1MUM3A4,4 Obsidian Huge Really Big Computers
BU8ZUPMP6V,Aqua Fun Wooden Computer
PRR366VPDC,Yellow New Really Big Pencil
FES4W6SQXE,Black Small Tiny Trash Can
973FWL18Z6,Obsidian New Amazing Trash Can
ES934EGGO8,Obsidian Bad Wooden Pen
7IFZOMPZ03,Purple Tiny Really Big Trash Can
HA2HOBPF8F,5 Aqua Big New Trucks
E42E4QJ16F,Green New Really Big Pillow
ERDGGXQSNV,6 Golden Bad Really Big Tvs
1PTGATT555,Black Ugly Huge Video
FYUB41QJWJ,Blue Huge Bad Book
4RDAXCLVI2,White Bad Wooden Car
AJT4FO1ZWH,Red Big Amazing Pen
SSW2497NW1,7 Red Bad Small Boats
ONIDJQ2JGH,Green Amazing Steel Coffee Cup
PQ6K1EA91T,Aqua Tiny Small Marker
QPSYH5ZS7W,Yellow Fun New Car
ZARA38DCTP,9 Aqua New Huge Videos
YYWYKSL2SX,4 Golden Big Bad Erasers
Q2N2HG86RO,Black Huge Big Boat
UVFFWCPM7I,Ruby Really Tiny Huge Boot
0A15W0IB94,Aqua Bad Fun Truck
JRJ3L2HV6M,9 Blue Fun Steel Erasers
ZCW7SXSFDM,2 Ruby Really Big Big Coffee Cups
FRQUN8DG0Q,4 Red Steel Big Dvds
GJIB6KDZM5,2 Obsidian Really Tiny Tiny Pillows
AC3T6TJK9M,Yellow Really Tiny Bad Marker
IRDYT42B8J,Green Ugly Really Big Boot
VQT24L6XM7,Orange Small Fun Truck
IIXVOCQF5T,3 Yellow Big Ugly Erasers
ZFPWFQ9J2W,4 Yellow Steel Small Books
Y5643NYHGM,Green Small Wooden Truck
T3RENVOOSH,7 White Really Big Really Tiny Computers
5JZKHKF26L,9 Obsidian Small Big Pens
91O7C7RHW4,Onyx Really Big Steel Boat
ZMH1RCS6MY,Golden Small Wooden Pillow
87TUR0NHXT,Yellow Tiny Fun Boat
SDOZYW5Z8F,Ruby Huge Fun Trash Can
GPOWE933RO,Golden Big Tiny Table
UEDRL3XI1B,White Amazing Bad Trash Can
MOGKETXDCV,Blue Small Fun Car
H9R9EBOBSE,Yellow Steel Tiny Boot
NU01N9MSRL,Aqua Really Big Amazing Trash Can
PTP57ZFRDX,White Really Tiny Bad Table
MPBRDZMGC1,Ruby Small Big Coffee Cup
CAMJSIEQIR,Orange Bad Amazing Coffee Cup
C18MO212F5,4 Ruby Huge Amazing Trucks
JXZK9V5WAO,Obsidian Ugly Bad Computer
5PMPVH3238,Yellow Really Tiny Fun Pillow
AP3V3GW2ZJ,2 Yellow Bad Really Tiny Tvs
TW0B3VR183,Red Really Big Steel Tv
TEG8RJP2LF,Blue Ugly Bad Video
XH9Y6XTPCL,White Huge Amazing Computer
NCRW110QW9,Orange Big Small Pen
6WXA3SZZI1,Red Really Big New Boot
BYEGJLRB1D,Black Bad Huge Pencil
T9BB0M2ATX,Onyx New Tiny Chair
MSLJB948WT,3 Green Really Tiny Wooden Pillows
4OONFISUWP,Obsidian Small Ugly Eraser
BVHJAC1HZG,Blue Amazing New Marker
QWAL3SWY2M,Ruby Really Tiny Really Big Marker
3FXK0ODO7E,Blue Small Big Boat
9QOSVBOYV9,Green Ugly New Shoe
TQD6LIX5A8,Red Big New Car
QN2N02URFK,9 Yellow Huge Amazing Cars
2U45NJQ3M5,Golden New Big Pencil
PXMT7D1GZ8,Red Tiny Really Tiny Truck
A8IGVO5IBE,Green Fun Tiny Video
OYJV3VFVOY,4 Green Ugly Big Dvds
AO2TB1XYMN,Yellow Bad Really Tiny Eraser
182JKQSTD1,Blue Steel Really Tiny Chair
AU73531174,Obsidian Small Really Tiny Boat
PC12IEB8LG,Green Really Big Small Dvd
PF6MXDCRMU,Purple Bad Small Pillow
4AUTVTLSMR,Green New Big Pen
OBHLNZ5FBG,White Steel Really Big Table
L8I3ZKJDF4,White Ugly Huge Table
RJNJQ7X7Q2,White Wooden Ugly Shoe
0S5CZARC9N,8 Obsidian Steel Really Tiny Boots
