asin,name
3BR6Z02QET,5 Obsidian Ugly Amazing Shoes
V78YDG7L2R,5 Green Fun Tiny Books
DPLBP21V51,Blue Really Big Wooden Car
PJARUY08UV,Black Wooden Amazing Pillow
DG1NAW1WEW,Green Really Tiny Tiny Marker
O8R48UUZVH,Purple Fun Big Pen
NNXDR0O4V3,Obsidian Fun Small Computer
YHM34GOWE8,Aqua Wooden Amazing Eraser
RQFKZB5GSD,Black Tiny New Pencil
4F29K0OWZ2,Obsidian Ugly Bad Truck
4AR6WIF083,Blue Big Steel Table
YHY212347Y,Red Tiny Small Pillow
SD1SEWRS7N,Orange Wooden Ugly Chair
3W6Q0QJ4LF,6 Green Really Tiny Steel Shoes
SE8BXY73CL,Yellow Amazing Steel Marker
7G7417BG8Y,Purple Big Small Marker
195SRFE42K,Obsidian Steel Wooden Shoe
1D6VKZ1T1I,Blue Huge Big Tv
7QSHO8ZEPK,Onyx Fun Steel Boot
7BACD8FJND,Red Really Tiny Really Big Book
WUV60OQM14,White Big New Video
SAA3MUSRSS,Onyx Ugly Really Tiny Chair
EUAZDDNHYB,White Tiny Small Dvd
KGS167SNZ0,Green Big Tiny Table
WDJ6XDS2ZM,Obsidian Really Big Bad Boot
T02EI6ERXV,Black Really Big Steel Truck
BBPA97WAH9,Yellow Small Really Tiny Coffee Cup
5SXYTFX3YF,Green Really Big Amazing Pen
D8R6VWEG47,Obsidian Really Tiny Huge Computer
8GZFM659J1,Aqua Bad Really Big Shoe
WYFDPNWZEO,8 Obsidian Fun Big Tables
HIW2433NR9,Blue Really Big Tiny Pen
S3CIOCIAQM,Green Really Tiny Big Book
DGKGBMRLD3,Onyx Tiny Big Computer
HA4CMFSIY6,Blue Really Big Fun Video
0HSWHV764L,Purple Fun Ugly Tv
1DVVGTT5W6,3 Aqua Tiny Big Tables
7YCJGCE2N3,Black Really Tiny Wooden Car
DUDVLXF8QF,Green Big New Shoe
ANC41LDWVF,Purple Really Big Steel Coffee Cup
V4WKSEWZTZ,Orange Small Really Big Computer
SNQGWFRMLD,Orange Huge Ugly Computer
4J9N4A3RS8,Blue Tiny Huge Table
KJKTCU5WIC,Aqua Steel New Pillow
N2K5LR2XJI,Blue Big Wooden Coffee Cup
2O57HOQSEV,Orange Fun Small Pen
RC3KL03M81,8 Blue Small Really Tiny Trucks
UT7QTG4DFT,Onyx Really Tiny Small Marker
QR5Z33Z3GD,Red Fun Ugly Book
BHQPOGJTA2,Onyx Steel Amazing Eraser
2WUQISUNEN,Purple New Really Big Boot
FYVEUBDRZ9,Obsidian Steel Small Dvd
CYM3FK5ZBF,White Bad Huge Dvd
FPA615JS27,Red Steel Ugly Truck
K1BZ2FLBMC,Black Fun Really Big Dvd
BGGUBK5J6H,Orange New Huge Truck
OQJ9JD1HB4,Black Big Fun Boot
LB2B9SEKHC,5 Onyx Really Tiny Bad Tables
8DELYE3013,Orange Steel New Marker
NSQYNQIQZ9,Green Bad Really Big Boat
RPK8AUWOVW,Blue Amazing Huge Eraser
NKT1H3HP32,Golden Huge New Boat
RFA6JNCHPA,Purple Wooden Huge Dvd
Q4TMW8Q31R,Golden Wooden Steel Coffee Cup
APUEV5HPK8,Black Really Tiny Huge Trash Can
341EDJ77DG,Blue Really Big Small Boat
QVI1MAF8DJ,Ruby New Big Boot
RSE4J0R0I6,Ruby Ugly Really Tiny Pencil
T3FD5NBM4S,Purple Big Small Book
GU9I6OQ5B1,Yellow Big Tiny Dvd
OH8EK6RWZG,Red Big Really Big Trash Can
LVJ5II490K,Yellow Amazing Big Video
JUFUH9ANJ0,Green New Big Dvd
A2AJN0BN38,5 Aqua New Steel Boots
0KUDST2SMN,Yellow Huge New Dvd
LJP1T0UFLW,Ruby Really Big New Tv
4TXHSZGOXJ,Red Wooden Fun Pencil
CAXFBHDIG4,Green Fun New Tv
MVL71F2PSM,Green Really Big Really Tiny Table
DSRCBG9DK1,5 Yellow Bad Steel Pens
RRP2CE8YPD,9 Obsidian Really Tiny Wooden Pencils
UR20ITJ68Y,White Small Huge Boot
1G05NWYBAK,Black Ugly Amazing Book
5OKI1SAVHO,Red Tiny New Computer
0R84NKNEX5,3 Ruby Huge Wooden Shoes
ZEBRO4KGSC,Golden Huge Bad Marker
ZQMSTNR1ZO,Yellow Big Amazing Coffee Cup
OWQVMYPXJW,Black Big Really Big Computer
7MCVB6QUE0,Orange Bad Ugly Marker
PG1UNP2HAO,Black Steel Small Video
IVYUVSE0B1,8 Obsidian Amazing Tiny Markers
PLX42YQN60,3 Onyx Really Tiny Really Big Dvds
SJSVH12IPU,Golden Small New Book
SNSNMW1JCY,Blue New Really Big Table
TG62USVKAZ,Black Huge Wooden Trash Can
RIIHKGXKOT,Blue Amazing Steel Pen
X6X3UCTRDY,Red New Ugly Pencil
C3I9Q8FE15,Blue Fun New Marker
EYBITVHGJ3,Green Really Tiny Small Video
Q8IU1HAG3H,3 Black Wooden Big Cars
F72ZGS3YCL,9 Blue Really Big Tiny Markers
8I0NIZGQF9,Green Huge Wooden Eraser
XN5899AB3A,Orange Really Big Bad Truck
AMKSNDYJMX,Ruby Ugly Huge Boot
Y7MLCK98KF,Obsidian Ugly New Book
EMGJIBGZ53,Orange Huge Amazing Tv
VG6NRL3ADZ,3 Black Big Really Big Dvds
Z27IRO9F5A,Yellow Fun Amazing Book
6YSYY1RVW8,7 Ruby Ugly Small Tables
UNRFX8VCZM,Obsidian Bad Wooden Video
SDSH7T1ZYK,Purple Really Big Amazing Table
YUVWK3TYP9,White New Amazing Pencil
XREKVOW8DM,8 Obsidian Bad Wooden Cars
SU8DN48H3Y,White New Huge Dvd
FANNTDRGZN,Onyx Amazing Steel Truck
RPEBFWNOPT,Golden Amazing Huge Table
5J6SWMOS47,3 Orange Ugly Really Tiny Markers
40JBV9YYS8,Green Huge New Pillow
3WYFTP5CEY,Ruby Wooden Bad Boot
ESCXENY4HW,Golden Wooden Steel Marker
H4SCA56Y4J,Black Amazing Big Boot
81Y8480OCN,Orange Really Big Really Tiny Pencil
O9Q23WUQMZ,Red Tiny New Tv
6DPGOU1I1Y,Orange Huge Ugly Pillow
DDH2Y6720C,Green Steel Bad Pencil
AV09SLBDG7,Yellow Really Tiny Bad Trash Can
HQ1X9CX8BK,Orange Tiny Steel Dvd
Y596RNLNBQ,Green Really Tiny Fun Book
OAFSD6RS27,Black Really Tiny Wooden Computer
VN3DQNELD0,Aqua Wooden Fun Video
5XCQI82CVI,8 Green Fun New Markers
IGKMDR7M85,Onyx Tiny Bad Pen
IXWJYYJO1L,White Tiny Huge Coffee Cup
CIAPPNZW71,White Fun Bad Dvd
8KNLSOD2BO,Aqua Fun Tiny Pen
R20UVZH7YP,Black Wooden Fun Coffee Cup
PFGZUPOE3E,Yellow Wooden Really Big Boot
C6DQBTNKBT,Black Really Big Wooden Video
ZPNEEBRL11,Green Really Tiny New Computer
38J718ZU24,Golden Small Amazing Eraser
KM9L48JWM2,Onyx Tiny Bad Coffee Cup
OBYTI1H4BJ,4 Red Small New Markers
2ZYY2A5X83,9 Green Really Tiny Steel Boots
6983H4RC4B,6 Yellow New Huge Boats
6SPZK6VS7R,Blue Bad Amazing Video
0DSTK619ZN,Aqua Steel Amazing Tv
LYQH354VM8,Ruby Steel Bad Book
HFO5IF829D,Green Wooden Big Pencil
D4ZMK98B9Y,Blue Ugly Fun Shoe
BH1XYAB7LC,Purple Amazing Ugly Computer
DXUXOWE22B,Purple Amazing New Truck
NK451WPQ8H,Red Really Tiny Amazing Truck
7B49Q4663G,4 Onyx Ugly Steel Dvds
T55Z9PN5EC,White Steel Fun Tv
HV23CJYKGR,Obsidian Fun Wooden Computer
XLO09BG91N,Obsidian Ugly Wooden Chair
4RACZ5DC98,Purple Really Big Big Boat
OG1Z01QTAT,Black Steel Ugly Tv
2JYJVTU3JE,Onyx Fun Really Tiny Video
A9D1F1A49A,Obsidian Really Tiny Huge Tv
F7N5BJPHQU,Blue Tiny Amazing Pillow
PW9MJU1TZS,Yellow Small Really Big Chair
EXZEM6K639,Aqua Steel Really Big Truck
SKY4FHENWW,Green Bad Amazing Eraser
IFRBB88FAX,Purple New Steel Trash Can
U9L3YVUSI1,Purple Big Bad Chair
KC1K4S47TL,Obsidian Ugly Wooden Boat
KK32T6VKD0,2 Golden Really Big Ugly Coffee Cups
0QRS8NR00G,Yellow Wooden Steel Dvd
AIGX83BZ62,Black New Big Eraser
55E2RK5TVU,Purple New Really Tiny Coffee Cup
P0II1B4LLO,Purple Wooden Small Truck
YIPW0MO2IA,Green Really Big Big Boot
XDBQID8TAX,4 Purple Fun Amazing Pens
XH72MZEP6G,Yellow Tiny Wooden Table
Z4YK2AYCZ8,Onyx Steel Ugly Truck
TZ0AG84WJ2,5 Black Wooden Amazing Pencils
N6PFAM5UOJ,Blue Small Big Truck
RCEDYJWSKH,Aqua Bad Really Big Boot
RBAFQZ5IK2,White Ugly Amazing Chair
VLLJQK5RU4,Black Wooden Steel Coffee Cup
Q88QL2E27W,Orange Tiny Fun Pencil
JXXNO1YA9P,White Bad Small Boat
C1Z37DCPZX,2 Red Huge Wooden Markers
86WBQ5ABOR,Red Big Ugly Truck
KEMBFVVUE2,Golden New Fun Table
MKEM746GQT,Purple Fun Big Coffee Cup
LSCS6JZ7K7,Blue Wooden Fun Pillow
A6I9BJ2O27,Onyx New Wooden Book
MLN61U5XK6,Red Really Big Small Table
GRWB1SLGB7,Green Really Tiny Ugly Pillow
P6K4U6KG2I,Purple Big Wooden Table
T3A9GYEEP7,Orange Huge New Boot
90B2772NZR,Purple Really Tiny New Marker
IDTS4BI9MJ,Obsidian Bad Tiny Car
79I8DF5QLQ,6 Onyx Big Bad Computers
JK5HYNKPNC,2 Blue Tiny Really Tiny Pillows
GZSPIAF97H,Orange Steel Ugly Table
I5U3F0AHW2,Blue Bad New Truck
WOB7L6H2PA,Obsidian Bad Tiny Pencil
85121KQ2SH,Blue Fun Tiny Tv
TKZYBGBGRX,9 Aqua Big Wooden Boats
J8OEKDJCYG,Obsidian Steel Really Tiny Pencil
0OFX6TL00M,Golden Ugly Amazing Dvd
7972RO7PBF,Ruby Fun Really Tiny Coffee Cup
8VLO7O1DTD,3 Onyx Big Ugly Erasers
1HN67BT7P0,6 Red New Amazing Shoes
PGK3G113B1,Yellow Ugly Big Eraser
HCJYRUB1J7,7 Red Big Really Tiny Pencils
PM6NA5RWG6,Onyx Fun Really Big Pen
MM1NUJMTL7,Blue Tiny Wooden Trash Can
VY8CGNMDBF,Red Small Really Big Pillow
BWK9RJBKPY,Obsidian Wooden New Table
B0C8WQWLHQ,Black Amazing Ugly Tv
XKKV0B5M7J,9 Onyx Bad Steel Videos
9C4WMDZCA9,Onyx Wooden Huge Marker
O34SPLXM5B,Ruby Really Big Wooden Chair
IVIK0P1AIX,Black Really Tiny Steel Pen
EISR3RQ5JC,White Big Steel Computer
F9U7JAQPXJ,7 Golden Huge Ugly Dvds
KCH2E6BSE1,Yellow Huge Really Tiny Car
OZH3VWO1G2,Purple New Steel Table
4R2XFMLO2Q,Red Wooden Small Marker
30KPIVLDD6,Onyx Tiny Big Dvd
YPX2LQIAQU,8 Ruby Bad Tiny Pencils
S0M3YXA8N2,White Wooden Small Video
GOQW7RY0H7,3 Black Fun Ugly Books
51HNSCG4O1,Ruby Wooden Steel Computer
798OWDHLQG,Onyx Really Big Really Tiny Truck
1WYT35UHRQ,Obsidian Wooden Fun Shoe
JMNTWSTNGN,Purple Tiny Big Marker
GWTXR7YGPT,Green Wooden Amazing Car
YR2O2X7WYH,Yellow Steel Small Coffee Cup
WEUMRE46LM,9 Yellow Small Ugly Tvs
N0UVSIZKBO,Green Really Tiny Tiny Computer
R355NA87SG,Onyx Small New Tv
V1O5MJH3T3,Aqua Wooden Tiny Boat
4OR415H8SN,Orange Fun Amazing Car
VY55SXY39P,4 Aqua Wooden Big Boots
T6C7UALQOS,Orange Big Tiny Trash Can
D4E9P925SM,White New Big Video
YAYAXQNV1M,3 Purple New Really Big Boots
9ZL2CWJUKM,Red Bad Ugly Chair
MFUQ7RLBN0,Aqua Huge Ugly Dvd
XW3Q7KHOHT,Black Fun Really Tiny Car
MMK3M365AV,White Bad Really Tiny Tv
NPPIX0IMDZ,Onyx New Bad Pen
PUM0ZL9VCN,Aqua Wooden Big Computer
TILYJDQ606,Orange Wooden Really Tiny Coffee Cup
01GJHC04I4,Yellow New Amazing Pillow
IAML2U6X75,Red Ugly Huge Book
I31DWUET3H,Obsidian Tiny Bad Table
FAVE3EHLDR,Blue Tiny Ugly Trash Can
WWWVZFCQMO,Aqua Big Bad Coffee Cup
SW38K2VFTU,Blue Really Big Huge Truck
532T8WG6GE,Yellow Huge Really Big Chair
DNFI20K8RW,Aqua Small Tiny Computer
01LWZV8ALK,Onyx Ugly Steel Pen
93AJEAQVSQ,5 Red Fun Wooden Pillows
5HXHNOQFED,White Bad Really Tiny Trash Can
Z712D0ZBOZ,Red Big Really Tiny Table
OWHOJIBPAY,Yellow New Steel Trash Can
NKQZFGYP19,Black Fun Really Tiny Pillow
YTL6OM2K2H,Purple Small Big Video
X13YS7ELCM,Yellow Amazing Wooden Eraser
XCNILU1BDH,4 Golden Tiny Small Trucks
1V08H77NLA,Obsidian Really Tiny Wooden Pen
WFCPE58ULX,4 Golden Ugly Amazing Coffee Cups
SGEB9M2M8Q,Yellow Really Tiny Big Table
29DSF49R1D,Golden Amazing Wooden Trash Can
EY1AYP0FH8,Orange Fun Tiny Pillow
U0ZVYZUJOR,Purple Small Tiny Pen
917NJQQT0M,White Big Small Table
ZR7A5UYVLK,Onyx Wooden Small Boot
CQPZMSVTLB,Obsidian Steel Small Eraser
NY1942XSKT,Golden Really Big Huge Book
UC18KLWLPM,6 White Ugly Amazing Pencils
TBGGD53TSA,Purple Ugly New Tv
2KG20SLVUN,Onyx Really Tiny Huge Pillow
9D8BBQUCRK,Ruby Bad Steel Coffee Cup
OHIQNIP4HP,Purple Bad Fun Pillow
2PZCTE2SXF,Onyx Really Tiny Wooden Boot
AA761JBWCV,Aqua Huge Fun Eraser
CSRZSIXR50,Aqua Tiny Really Tiny Video
BZYGIRRVRW,Red Really Tiny Ugly Table
7GEWDVTO77,Orange Really Big Fun Trash Can
V8HIWGOYFY,5 Blue Really Big Amazing Pencils
U2ATA66P8J,9 Blue New Ugly Chairs
KY30XWIVSP,Ruby Big Tiny Shoe
RAJLASZBUU,5 Golden Tiny Really Big Cars
N2NPJO7HK9,Onyx Small New Pencil
ZDS1NT1B5Z,Red New Steel Table
KQ9TDO3WNZ,Orange Steel Big Coffee Cup
RHB9B4JWP1,Blue Huge Really Tiny Trash Can
AANC6O9FFT,Black Ugly Steel Dvd
OOUTN5IBOI,7 Black Small Ugly Trucks
LD2HV6APQ8,Purple Fun Really Tiny Pen
XQSDWVLQT5,5 Yellow Wooden Ugly Tables
A0OCLZ2FH2,Blue Really Big Bad Pen
S8VXMIY4L0,Ruby Small Amazing Trash Can
6GPI24EWXG,Aqua Really Big Tiny Table
